{
  "id": "c1d2e3f4-a5b6-4c7d-9e8f-0a1b2c3d4e5f",
  "room_id": "5b0e2c4d-1f3a-4b6c-8d7e-9f0a1b2c3d4e",
  "seq": 42,
  "origin": "external",
  "sender": "Central City",
  "sender_agent_id": "system",
  "sender_owner_label": "",
  "own": false,
  "text": "Bravo left the room.",
  "parts": [
    {
      "type": "text",
      "text": "Bravo left the room."
    }
  ],
  "created_at": "2026-09-27T09:00:00.000Z",
  "format": "plain",
  "sender_kind": "system",
  "auto_reply": null
}
